{
  "artifactType": "coxeter-torsion-free-discovery",
  "bounds": {
    "maxCandidates": 4,
    "maxIndex": 10,
    "maxSphericalOrder": 1000,
    "maxSubsets": 16,
    "maxWitnesses": 64,
    "timeoutSeconds": 90
  },
  "certificate": {
    "claims": [
      "finite-index",
      "torsion-free"
    ],
    "completeTorsionWitnessCatalogue": true,
    "coxeterRelationChecks": [
      {
        "exponent": 2,
        "generators": [
          0,
          0
        ],
        "kind": "involution",
        "passed": true
      },
      {
        "exponent": 2,
        "generators": [
          1,
          1
        ],
        "kind": "involution",
        "passed": true
      },
      {
        "exponent": 5,
        "generators": [
          0,
          1
        ],
        "kind": "coxeter",
        "passed": true
      }
    ],
    "criterion": "tits-prime-order-fixed-point",
    "explanation": "Every prime-order conjugacy-class witness from every maximal spherical special subgroup acts without a fixed coset. By Tits' torsion theorem, the point stabilizer is torsion-free.",
    "noFixedPointChecks": [
      {
        "fixedVertexIds": [],
        "passed": true,
        "primeOrder": 2,
        "witnessId": "tw0",
        "word": [
          0
        ]
      },
      {
        "fixedVertexIds": [],
        "passed": true,
        "primeOrder": 5,
        "witnessId": "tw1",
        "word": [
          0,
          1
        ]
      },
      {
        "fixedVertexIds": [],
        "passed": true,
        "primeOrder": 5,
        "witnessId": "tw2",
        "word": [
          0,
          1,
          0,
          1
        ]
      }
    ],
    "nonClaims": [
      "normal subgroup",
      "minimal index",
      "manifold",
      "virtual algebraic fibering"
    ],
    "status": "passed",
    "theoremBasis": [
      "Tits torsion theorem for Coxeter groups",
      "prime-order reduction in finite cyclic subgroups",
      "coset fixed point iff a conjugate lies in the stabilizer"
    ],
    "transitive": true
  },
  "errors": [],
  "finiteAction": {
    "cosetConvention": "GAP FactorCosetAction; q0 is the subgroup base coset",
    "degree": 10,
    "edges": [
      {
        "generator": 0,
        "id": "qe:q0:g0:q1",
        "label": "s0",
        "source": "q0",
        "target": "q1"
      },
      {
        "generator": 0,
        "id": "qe:q1:g0:q0",
        "label": "s0",
        "source": "q1",
        "target": "q0"
      },
      {
        "generator": 0,
        "id": "qe:q2:g0:q4",
        "label": "s0",
        "source": "q2",
        "target": "q4"
      },
      {
        "generator": 0,
        "id": "qe:q3:g0:q5",
        "label": "s0",
        "source": "q3",
        "target": "q5"
      },
      {
        "generator": 0,
        "id": "qe:q4:g0:q2",
        "label": "s0",
        "source": "q4",
        "target": "q2"
      },
      {
        "generator": 0,
        "id": "qe:q5:g0:q3",
        "label": "s0",
        "source": "q5",
        "target": "q3"
      },
      {
        "generator": 0,
        "id": "qe:q6:g0:q8",
        "label": "s0",
        "source": "q6",
        "target": "q8"
      },
      {
        "generator": 0,
        "id": "qe:q7:g0:q9",
        "label": "s0",
        "source": "q7",
        "target": "q9"
      },
      {
        "generator": 0,
        "id": "qe:q8:g0:q6",
        "label": "s0",
        "source": "q8",
        "target": "q6"
      },
      {
        "generator": 0,
        "id": "qe:q9:g0:q7",
        "label": "s0",
        "source": "q9",
        "target": "q7"
      },
      {
        "generator": 1,
        "id": "qe:q0:g1:q2",
        "label": "s1",
        "source": "q0",
        "target": "q2"
      },
      {
        "generator": 1,
        "id": "qe:q1:g1:q3",
        "label": "s1",
        "source": "q1",
        "target": "q3"
      },
      {
        "generator": 1,
        "id": "qe:q2:g1:q0",
        "label": "s1",
        "source": "q2",
        "target": "q0"
      },
      {
        "generator": 1,
        "id": "qe:q3:g1:q1",
        "label": "s1",
        "source": "q3",
        "target": "q1"
      },
      {
        "generator": 1,
        "id": "qe:q4:g1:q6",
        "label": "s1",
        "source": "q4",
        "target": "q6"
      },
      {
        "generator": 1,
        "id": "qe:q5:g1:q7",
        "label": "s1",
        "source": "q5",
        "target": "q7"
      },
      {
        "generator": 1,
        "id": "qe:q6:g1:q4",
        "label": "s1",
        "source": "q6",
        "target": "q4"
      },
      {
        "generator": 1,
        "id": "qe:q7:g1:q5",
        "label": "s1",
        "source": "q7",
        "target": "q5"
      },
      {
        "generator": 1,
        "id": "qe:q8:g1:q9",
        "label": "s1",
        "source": "q8",
        "target": "q9"
      },
      {
        "generator": 1,
        "id": "qe:q9:g1:q8",
        "label": "s1",
        "source": "q9",
        "target": "q8"
      }
    ],
    "generatorActions": [
      {
        "generator": 0,
        "images": [
          "q1",
          "q0",
          "q4",
          "q5",
          "q2",
          "q3",
          "q8",
          "q9",
          "q6",
          "q7"
        ]
      },
      {
        "generator": 1,
        "images": [
          "q2",
          "q3",
          "q0",
          "q1",
          "q6",
          "q7",
          "q4",
          "q5",
          "q9",
          "q8"
        ]
      }
    ],
    "subgroupGenerators": [],
    "vertices": [
      {
        "id": "q0",
        "representativeWord": []
      },
      {
        "id": "q1",
        "representativeWord": [
          0
        ]
      },
      {
        "id": "q2",
        "representativeWord": [
          1
        ]
      },
      {
        "id": "q3",
        "representativeWord": [
          0,
          1
        ]
      },
      {
        "id": "q4",
        "representativeWord": [
          1,
          0
        ]
      },
      {
        "id": "q5",
        "representativeWord": [
          0,
          1,
          0
        ]
      },
      {
        "id": "q6",
        "representativeWord": [
          1,
          0,
          1
        ]
      },
      {
        "id": "q7",
        "representativeWord": [
          0,
          1,
          0,
          1
        ]
      },
      {
        "id": "q8",
        "representativeWord": [
          1,
          0,
          1,
          0
        ]
      },
      {
        "id": "q9",
        "representativeWord": [
          0,
          1,
          0,
          1,
          0
        ]
      }
    ]
  },
  "inputHash": "60c38b9d0b896c2e64f54a05dfb925919d1e895af006d26e563c2f16b2746efe",
  "ok": true,
  "provenance": {
    "artifactHash": "e7b89d49419089fc28791b5a916cffd16b49a0dc658c69fe284c6d24b1138a3a",
    "backend": "gap-low-index-torsion-free",
    "backendVersion": "1.0.0",
    "command": "wsl /opt/miniforge3/envs/sage/bin/gap -q -c <temporary-path>",
    "gapVersion": "4.14.0",
    "inputHash": "60c38b9d0b896c2e64f54a05dfb925919d1e895af006d26e563c2f16b2746efe",
    "runtime": "wsl",
    "runtimeDiagnostics": [
      "wsl gap exited 127 without structured output: /bin/bash: line 1: gap: command not found"
    ],
    "runtimeLabel": "wsl sage-environment gap"
  },
  "schemaVersion": 1,
  "search": {
    "candidatesChecked": 1,
    "iteratorComplete": true,
    "maxCandidates": 4,
    "maxIndex": 10,
    "method": "LowIndexSubgroupsFpGroupIterator",
    "reason": "certified-candidate"
  },
  "sourceSystem": {
    "coxeterMatrix": [
      [
        1,
        5
      ],
      [
        5,
        1
      ]
    ],
    "generators": [
      {
        "id": "s0",
        "label": "s0"
      },
      {
        "id": "s1",
        "label": "s1"
      }
    ],
    "name": "I2(5)",
    "notes": [
      "Self-test input for automatic torsion-free subgroup discovery."
    ],
    "rank": 2,
    "schemaVersion": 1
  },
  "sphericalCatalogue": {
    "complete": true,
    "maximalSubgroups": [
      {
        "order": 10,
        "subset": [
          0,
          1
        ],
        "type": "I2(5)"
      }
    ],
    "method": "complete-finite-coxeter-classification+gap-prime-order-classes"
  },
  "status": "passed",
  "torsionWitnesses": [
    {
      "classSize": 5,
      "id": "tw0",
      "primeOrder": 2,
      "sphericalOrder": 10,
      "sphericalType": "I2(5)",
      "subset": [
        0,
        1
      ],
      "word": [
        0
      ]
    },
    {
      "classSize": 2,
      "id": "tw1",
      "primeOrder": 5,
      "sphericalOrder": 10,
      "sphericalType": "I2(5)",
      "subset": [
        0,
        1
      ],
      "word": [
        0,
        1
      ]
    },
    {
      "classSize": 2,
      "id": "tw2",
      "primeOrder": 5,
      "sphericalOrder": 10,
      "sphericalType": "I2(5)",
      "subset": [
        0,
        1
      ],
      "word": [
        0,
        1,
        0,
        1
      ]
    }
  ],
  "warnings": []
}
